,date,content
0,2022-09-09 23:03:53+00:00,"Queen Elizabeth II, Britain’s Longest-Reigning Monarch, Dies at Age 96 |... https://t.co/GE3ZvhrPxd via @YouTube"
1,2022-09-09 21:29:27+00:00,"Yeah and Bezos out here tryna shame this lady for the trauma and tragedy her family had to endure because of Queen Liz, fuck the monarchy!!! https://t.co/3c3wbAxpaQ"
2,2022-09-09 20:47:21+00:00,"Lisa LaFlamme is back on TV after her abrupt dismissal from CTV last month. 

As a special correspondent for CityNews, this is right where Ms. LaFlamme belongs — bringing Canadians monumental news from Britain, covering the Queen’s funeral and the transition to King Charles. https://t.co/8KHHTKeLv4"
3,2022-09-09 17:11:39+00:00,"Oh okay King Charles....you know what you were doing with that speech/first address, and are clearly aware of current conversations surrounding HM The Queen, the family in general, and the institution of Monarchy."
4,2022-09-09 16:58:31+00:00,"To me, this was such an interesting and clearly measured moment from an icon who has had an interesting dynamic with the royal family over many years… https://t.co/mWH3POQ50x"
5,2022-09-09 15:12:32+00:00,Everyone whose like the Queen was a person with a family…and SO WAS HITLER…what’s your point?!
6,2022-09-09 13:49:01+00:00,"As Queen Elizabeth II's family and friends continues to pour into Balmoral, people throughout the world are mourning her death, and celebrating the life she lived. To learn more about the life of Queen Elizabeth II, check out the following blog: https://t.co/RBvvcM8Sxg"
7,2022-09-09 12:36:12+00:00,"when I was on the @nationalpost ed board, I was the cranky republican anti-monarchist, banging on about the accident of birth. But as i watch sanctimonious social-justice harpies react to the queen's death, I'm wavering: Whatever side these hashtag ghouls are on, I'm on the other"
8,2022-09-09 11:53:30+00:00,"Well said James, much respect. Growing up in 1970’s Britain, the Queen was a guiding light and an active leader of service, love and honour. The world was better with her in it. My thoughts are with her family 💔 https://t.co/f4mPj57OEf"
9,2022-09-09 11:16:00+00:00,"On the occasion of the death of Her Majesty Queen Elizabeth II, the President of the Republic of Cuba decreed Official Mourning, #Cuba expreses its heartfelt condolences to the Royal Family, #UK government and people. https://t.co/Huqtrhwfcn"
10,2022-09-09 05:28:22+00:00,How UK will change with the Queen's death? #queenelizabeth #britishroyals https://t.co/092hIvL89D via @YouTube @britishroyals @timesofindia
11,2022-09-09 04:32:40+00:00,@idlesband did we manifest the queen’s death in Toronto last night?? https://t.co/3GozY0oHrO
12,2022-09-09 02:15:19+00:00,Reporting today with @ACarterglobal  for @globalnewsto on the death of Queen Elizabeth II. I was outside St. James Anglican Cathedral in Old Town Toronto. My friend and neighbour John Stewart stopped by. He met Her Majesty twice and offered some memories.#QueenElizabeth https://t.co/fhyoYNzlwG
13,2022-09-09 02:14:31+00:00,"Everything I know about British royal family, was taught to me against my will."
14,2022-09-09 01:19:06+00:00,"Sept 8, 2022 🖤 RIP Queen Elizabeth II, the UK's longest-serving monarch, died at age 96, after reigning for 70 years. https://t.co/6uqhi2Ov92"
15,2022-09-09 00:56:10+00:00,@doogideon I hope he is able to sustain the monarchy like his mom.  The queen was loved by Charles isn't.  There is an undercurrent of republican sentiments in the UK.
16,2022-09-09 00:21:48+00:00,"breaking news: King Charles, the son from the royal family, is a nasty little thottie. and he just died from making it clap on instagram"
17,2022-09-09 00:09:14+00:00,My condolences go out to The Royal Family on the death of the late Queen Elizabeth II. In honor of her death I wanted to share The Beatles song called Her Majesty: https://t.co/z2x1rqrnyZ #QueenElizabeth #RoyalFamily #KingCharles #PrinceWilliam #PrinceHarry #HerMajesty #Beatles https://t.co/hmUqkuyw7M
18,2022-09-08 23:57:17+00:00,Wondering if the bills with HMTQ Elizabeth's picture will be updated. What more in UK. End of an era indeed 👑
19,2022-09-08 23:55:55+00:00,"From coast to coast, Canadians are mourning the death of the Queen. Flags across Toronto are being lowered to half mast. @CP24 https://t.co/BTZuTH997M"
20,2022-09-08 23:36:56+00:00,"The Very Reverend Stephen Vail, Rector of St. James Cathedral, shows me the Royal Bible bearing the signature of Queen Elizabeth II and other family members on one page. I also saw her signature as a princess during her first visit in 1951. #QueenElizabeth #QueenElizabethII https://t.co/NDdvGNEwRp"
21,2022-09-08 23:25:09+00:00,"If the Canadian govy does more for the royal family than they did when more of those residential school burials were uncovered, I’m actually going to lose it."
22,2022-09-08 23:18:37+00:00,"Shame on those who have capitalized on the Queen’s death as an immediate opportunity to advance specific viewpoints. The monarchy is a deeply flawed institution &amp; should ultimately be replaced, but today/this week is *not* the time for this debate. Show some actual class #cdnpoli"
23,2022-09-08 23:07:37+00:00,"I will miss you Queen Elizabeth.Your faith, service and love for us, your people. My condolences to the Royal Family. You have been our Queen since I was born and your example for all women remains a bright light. You had fun and did your duty with faith at heart. https://t.co/lrdmq9t4mi"
24,2022-09-08 22:41:33+00:00,@NouveauArtPunk Your dad is having more of a fun time than Cathy. She sent me a quote of the Queen apologizing to the Irish in 2011
25,2022-09-08 22:34:51+00:00,Did queen Elizabeth even live stream her death⁉️⁉️
26,2022-09-08 22:21:18+00:00,"The Bishop Strachan School was saddened to learn of the death of Her Majesty Queen Elizabeth II today. To remember her and mark her extraordinary female leadership, BSS has lowered our flag. As a community, we will acknowledge her passing in Chapel tomorrow. https://t.co/O69bUM1PHc"
27,2022-09-08 22:16:43+00:00,"Our deepest sympathies go out to the Royal Family.
#ripelizabethregina 🥲🥲 @ Timothy's Pub https://t.co/i3WmckEGpG"
28,2022-09-08 21:16:43+00:00,"With the death of Queen Elizabeth II, what happens to Canadian bills and coins? https://t.co/XeijITKP45"
29,2022-09-08 21:08:16+00:00,@RoyalFamily I'm so sorry for your loss. The Queen was such a wonderful woman. My Mom shares the same birthday. April 21st. I will be praying for your Royal Family.😔🇨🇦🇬🇧
30,2022-09-08 20:44:50+00:00,There is somebody right here on this website who learned about Queen Elizabeth’s death from Crazy Frog and I will be thinking about this for some time. https://t.co/5QK33no52q
31,2022-09-08 20:18:42+00:00,"@ddthots @RoyalFamily @lxstlosty The source is the official royal family Twitter account, which is the original poster of this message.  And if you are not sure, turn on a tv, or if you live in a Commonwealth country or the UK you can see the flags at half mast."
32,2022-09-08 20:14:36+00:00,@Ebonyteach The Queen wasn’t just a 96 year old woman who died. She was the embodiment of a political system. She may have been a very nice person &amp; I am sure those who knew her will mourn . That doesn’t mitigate the centuries of harm done by the UK/monarchy to countries/people around world
33,2022-09-08 20:04:14+00:00,"It is a somber day as we learn of Her Majesty Queen Elizabeth II’s passing.

I am reminded of her dedication, unparalleled sense of duty, and commitment to public service.

My thoughts are with the Royal Family and all those grieving in the United Kingdom and around the world. https://t.co/AkUqqpBMML"
34,2022-09-08 20:00:17+00:00,"We stand with the people of UK, Canada and the global community in mourning the loss of Queen Elizabeth II. https://t.co/DoLO0ESaxL"
35,2022-09-08 19:56:50+00:00,"Today on the Richard Syrett Show: Tom Korski, managing editor for Blacklocks discusses the death of Queen Elizabeth II. Melissa Mbarki, policy analyst &amp; outreach coordinator for the Indigenous affairs program at Laurier talks about the parole board horribly failing the https://t.co/jX6kDfltFg"
36,2022-09-08 19:55:54+00:00,Royal Family 'mourn profoundly' the death of mother and monarch Queen Elizabeth https://t.co/fXWIMZUl23
37,2022-09-08 19:55:34+00:00,@Britestoan @TheEagleist @LegalishCA And has been steadily shrinking ever since she gained the throne. Effectively she ruled over the death of colonialism.
38,2022-09-08 19:41:44+00:00,@idlesband did we manifest the queen’s death in Toronto last night?? https://t.co/eroYE6giu4
39,2022-09-08 19:35:44+00:00,Irish unionists dick riding the royal family https://t.co/5Gv18PfNZC
40,2022-09-08 19:31:01+00:00,"#ScarbT0 #Ward25 #TOPoli
#TOElxn2022 #TOElxn22 #TorontoVotes

On behalf of the Ashan Fernando Campaign our deepest condolences goes out to the Royal Family on the Queens passing."
41,2022-09-08 19:28:45+00:00,@Marina_Sirtis A lifetime of dedication and service to the UK and the Commonwealth.  I never knew a time without Queen Elizabeth until today.  There will never be another Queen like her.  I’m so saddened by her passing.  #QueenElizabethII #QueenofCanada 🇬🇧🇨🇦💙
42,2022-09-08 19:06:42+00:00,"With heavy hearts, The Salvation Army Canada and Bermuda Territory sends condolences to the Royal Family on the passing of Her Royal Highness Queen Elizabeth II. The Queen served her country and the Commonwealth faithfully for many years as our longest reigning monarch. https://t.co/g68pm3JgP1"
43,2022-09-08 19:01:08+00:00,The Royal Family has a grim history of colonialism but I kinda think putting all Britain's (or Canada's) sins of the last 70 years on the Queen is an easy way of not reflecting that elected governments were responsible for basically all of that.
44,2022-09-08 18:56:46+00:00,"@Chuks_Dave @Tellemmmmm Very. At the end of the day, the Queen is a mother, grandmother and the member of a family that loved her. Its just plain disrespectful."
45,2022-09-08 18:54:44+00:00,The somewhat obscure esoteric channels have been saying for at least a year now that things will get interesting after the Queen’s death. Let’s see..
46,2022-09-08 18:53:11+00:00,@johncarson 😭 thoughts condolences to you &amp; queen &amp; her family
47,2022-09-08 18:52:21+00:00,RIP Queen Elizabeth II. The longest serving monarch in British history. Sending condolences to the Royal family. https://t.co/gFcePZKOYO
48,2022-09-08 18:41:28+00:00,"There are too many pictures of Queen Elizabeth in my stamp collection to choose from, but here's a funky portrait from 1972, released the year my family returned from the U.S. to Canada and her royal ubiquitousness.

I'm certainly no monarchist, but still I will miss her. https://t.co/TospwXIW1T"
49,2022-09-08 18:21:31+00:00,The second part of the UK TV series House of Cards imagines a strained relationship between the prime minister and an activist King (a very thinly veiled version of then-Prince Charles) after the Queen dies. https://t.co/lwZjEcB1D1
50,2022-09-08 18:12:06+00:00,"For me the death of the #Queen is an end of an era. Mygrandparents would always refer to her when disciplining me. Josie, would you eat like that in front of the queen?Whether or not you believe a monarchy should exist, it was nice to see a woman respected &amp;in charge for so long"
51,2022-09-08 18:01:51+00:00,"thanks so much for sharing your thoughts and feelings about #QueenElizabeth. Even though I am not a fan of the Royal Family, she still holds a special place in my heart and helped to guide this world through many turbulent times."
52,2022-09-08 18:00:47+00:00,"NiagaraGives extends our deepest condolences and sympathies to the @RoyalFamily, the UK Government, and the entire United Kingdom on the passing of Her Majesty Queen Elizabeth II. 

God Save The Queen ❤️ https://t.co/tDX6LwZBE6"
53,2022-09-08 17:55:39+00:00,"Sad and Happy day for the UK. Sad Queen is gone, Happy 96 years celebration of life. #RIPQueenElizabeth #RIP #Queen #monarch #Sad #happy !!! https://t.co/4nGQAsAHyG"
54,2022-09-08 17:54:40+00:00,My thoughts and prayers to the family of the late Queen Elizabeth II 🕊🕊🤍🤍
55,2022-09-08 17:53:28+00:00,"Liverpool Feds joins the nation in mourning the passing of Her Majesty Queen Elizabeth II.

The club extends its condolences to the Royal Family and our thoughts are with all affected by the loss of our monarch of 70 years.🕊 https://t.co/CkBCoIGlRu"
56,2022-09-08 17:51:07+00:00,Prayers up for the Royal family at the passing of her Majesty Queen Elizabeth Il 🙏 #LongestReigningMonarch https://t.co/ioAfdVAQC5
57,2022-09-08 17:48:43+00:00,"The flags are being lowered to half mast after the death of Queen Elizabeth II. 
#onpoli https://t.co/i8wWVYtt7w"
58,2022-09-08 17:48:08+00:00,"Today is the saddest day for UK and the world that Queen Elizabeth II has died :(

Thank you for 70 years of service your Majesty 👑

#RIPQueenElizabeth"
59,2022-09-08 17:38:08+00:00,Deepest condolences go to the royal family today. Such devastating news. https://t.co/WYnuttMU3C
60,2022-09-08 17:28:11+00:00,"Thinking about it, the Queen treats her death just like how Beyoncé treats her album releases."
61,2022-09-08 16:31:18+00:00,"@RoyalFamily My thoughts are with Her Majesty Queen Elizabeth II at this time. Wishing her well, and sending my best to the Royal Family. 🇬🇧🇨🇦"
62,2022-09-08 15:54:42+00:00,"My 3YO has been wrapping her head around the concepts of the Queen *and* death lately, as it happens; I fear there will shortly be a LOT MORE questions"
63,2022-09-08 15:41:26+00:00,I went to Queen’s Park to meet the Queen in Toronto on her last visit to Canada. I took the first three photos. That’s me on the upper far right in the last photo. Hoping for best but I am glad she is comfortable and hope her family finds peace.  #QueenElizabeth https://t.co/j5HhAvpLRR
64,2022-09-08 13:56:40+00:00,"Not in the business of rejoicing in people's death

However, I ain't sad either. Them royals did some pretty bad stuff 

Be rid of the whole royal line"
65,2022-09-08 13:42:29+00:00,"Reports are that the Queen, Naija was seen being escorted by the UK authorities from Buckingham Palace as she shouted “IM THE QUEEN OF RAP! IM THE QUEEN OF RAP!”, with the Union Jack doused in what seemed to be urine."
66,2022-09-08 13:41:57+00:00,"It’s hard to over emphasize how upsetting the death of Queen Elizabeth will be for the surviving British WWII generation, like my 93 year old mom. Seems silly to younger generations, but the Royals were deeply important to the War generation. https://t.co/JWkWKN17By"
67,2022-09-08 13:26:38+00:00,"@aaronbrazell Yup! She is the Queen of Canada, which is where I am. I’m just not one of those folks who are into following the Royals (I think there are way less/a lower %age of the population who are in Canada vs in the UK)"
68,2022-09-08 12:55:09+00:00,What are the odds that Queen Elizabeth is already “out of office” but the British Royal Family &amp; British gov bureaucracy are delaying official announcing til everyone’s ready &amp; the core Royals (like Prince Charles &amp; William) are in their assigned places when it’s made public?
69,2022-09-08 12:36:39+00:00,"Lord the media is about to elizabeth us to death, literally https://t.co/d1FdZhcVm7"
70,2022-09-08 11:57:03+00:00,@CityMelanie @breakfasttv God bless the Queen my 🙏 are with her and her family at this time 🤗
71,2022-09-08 11:44:46+00:00,Reaction from the UK’s new prime minister @trussliz regarding the Queen’s health https://t.co/9XIj39svhw
0,2022-09-09 14:13:47+00:00,@DejaRiley Deja mwah my friend happy Friday may the queen Rest In Peace ur a special friend to me always hugs  from MontrealCanada  beautiful weekend to u family
1,2022-09-09 11:14:47+00:00,"Judging from the tweets i'm seeing, looks like boxing twitter is pretty upset that the UK fight cards are gonna get postponed because of the Queen's passsing.

Some of the tweets i'm reading are wild! Lol"
2,2022-09-09 06:08:19+00:00,at therapy this week: idk there’s just been a lot on my mind this week w the birth of trisha paytas’ child and the death of the queen of england:/
3,2022-09-08 23:16:42+00:00,"Same people clowning around at Queen Elizabeth II’s death are the ones wanting a holiday to mourn the loss. Je dis ça, je dis rien."
4,2022-09-08 20:49:53+00:00,Our Royal Family https://t.co/KS4vD5wxZQ
5,2022-09-08 20:21:26+00:00,"Stuck in work, in Montreal, dying to get out for a scoop to celebrate the Queen's death. An I'm already seeing the craic from the lads at home. It's not fair"
6,2022-09-08 19:58:50+00:00,"From my heart, tribute to a woman who has dedicated her life and service to her country and the world. An unwavering duty to her people, Queen Elizabeth will always be a standard of what it means to reign. My deepest condolences to the entire Royal Family. #QueenElizabethII https://t.co/PNXg3B55k1"
7,2022-09-08 19:33:20+00:00,RIP Her Majesty Queen Elizabeth. My thoughts are with the Royal Family.
8,2022-09-08 19:32:14+00:00,I was saddened to learn of Queen Elizabeth’s death. May her family find comfort in the out pouring of the world’s love and respect. #QueenElizabeth
9,2022-09-08 18:14:33+00:00,"R. I. P.  The Queen ""Ultra-Long Standby Time"" 🖤🖤🖤
The best wishes for The Great Britain. 
Canada is together with you forever 🇬🇧🇨🇦
#queenelizabeth @ Montreal, Quebec https://t.co/ab7N2MK5mQ"
10,2022-09-08 17:55:56+00:00,Liz truss first speech to the public is to announce Elizabeth’s death
11,2022-09-08 17:45:23+00:00,"The death of Queen Elizabeth II: Live updates. Charles immediately became King upon the death of his mother. As heir apparent since the age of three, he has been the longest serving heir to the throne in British history.
https://t.co/QCPdgCqqJD And he's a divorcee.
@RoyalFamily https://t.co/Wle4qaNryx"
12,2022-09-08 16:43:49+00:00,"God Save the Queen! 

“I declare before you all that my whole life whether it be long or short shall be devoted to your service and the service of our great imperial family to which we all belong.” https://t.co/BtdxFRtemX"
13,2022-09-08 01:11:48+00:00,@MavTheGolden I am heartbroken to hear that you have passed.  Please run and frolic with all the other dogs over at the Rainbow Bridge!! Please watch over your family❤️  RIP❤️
0,2022-09-09 22:35:32+00:00,@hana___anah No he was disrespectful when he was there and completely ignored royal protocol. I doubt the Royal family would want him there.
1,2022-09-09 18:42:56+00:00,"While I am wont to criticize the EFF, their press release in light of Queen Elizabeth’s death is one of the best yet. https://t.co/a3yWJPV8Bd"
2,2022-09-09 16:17:27+00:00,"“It’s a very emotional day for everyone in London, whether you supported the Royal Family or not. I think everyone’s just taking a minute to process and to grieve,” says Farah, a Vancouver woman living in London. https://t.co/7OgNXuucYb"
3,2022-09-09 16:16:46+00:00,"Popularity and graciousness of QE2 are for people of Britain to enjoy and applaud. Scars and pains of British atrocities, oppressions, brutalities and manipulative policies during colonial erras and post colonialism  are still felt by lot of nations."
4,2022-09-09 16:10:17+00:00,Here’s a projection screen for all you egocentric woke assholes making the Queen’s death about your sh1tty contracted politics. https://t.co/f87XYHlvIE
5,2022-09-09 14:13:49+00:00,"👏🏼👏🏼👏🏼

Lisa LaFlamme to join CityNews as lead correspondent following Queen's death https://t.co/WAAPhB1G11 via @citynewsottawa"
6,2022-09-09 12:41:14+00:00,@TomPark1n Seems devoid of normal human reactions. As someone who wants to lead the Con Party and the country he has issued no message of regret on the death of the Queen. This reflects his shallow nature.
7,2022-09-09 03:05:16+00:00,"Elizabeth had two severely disabled first cousins who were pronounced dead in the 40s-60s and placed in an institution, where they were never once visited by any member of the Royal family for the duration of their natural lives. Nerissa died in 1986, Katherine in 2014. https://t.co/KJiyRzyJ9A"
8,2022-09-09 01:47:41+00:00,"Please be mindful today of how your comments on social media might impact the millions of people the royal family has tried to exterminate, indoctrinate or displace over the centuries in order to grab their land."
9,2022-09-09 00:03:41+00:00,"What happens to Canada's currency, stamps, place names after the Queen's death? https://t.co/AOlz6X91Xo via @viawesome"
10,2022-09-08 23:42:44+00:00,"'I will miss her so': PM Trudeau mourns the death of Canada's Queen. PMJT said the monarch was ""thoughtful, wise, curious, helpful, funny and so much more. In a complicated world, her steady grace &amp; resolve brought comfort and strength to us all.” https://t.co/idGUSPcGHy #cdnpoli"
11,2022-09-08 21:12:47+00:00,We send our condolences to the Royal Family on the passing of Her Majesty Queen Elizabeth II. Flags at Langara College are lowered to half-mast in recognition of her long reign and service as Canada’s Head of State.
12,2022-09-08 20:57:56+00:00,Perfect time for the UK to change the national anthem to something about the people and not the royal family 👍🏻
13,2022-09-08 20:49:39+00:00,"@seerutkchawla I am not a monarchist and I was no fan of Elizabeth's. In fact, my family had a personal beef with her. But I am a fan of her son's so I've been framing everything I say in social media as expressing my condolences to our new king and welcoming him into his new job."
14,2022-09-08 20:45:17+00:00,@thehouseofpod Iranian version of reaction to the Queen's death https://t.co/G36mj5moSN
15,2022-09-08 20:29:41+00:00,The final illness and passing of our beloved Queen https://t.co/1tehzks4bd via @YouTube - #peace_rest_to_her_majesty_the_Queen_E sharing with dearest @LadyColinCampb @QueenEl65905372 @Charles_HRH - @Queen_UK @LadyColinCampb https://t.co/DEEzN3kNCM
16,2022-09-08 20:23:23+00:00,"I am genuinely concerned about the Queen’s corgis. Who’s looking after them? Where will they live? Who’s going to be giving them snacks? I nominate Charlotte, she seems to be the most capable member of the family."
17,2022-09-08 20:18:44+00:00,"@givepeazachance I'm having similar emotions. My Mum was very keen on the Queen and she passed just days before Diana's funeral, which to me felt it was held for my Mum. With some of my family I witnessed the funeral procession to Westminster Abbey."
18,2022-09-08 19:54:38+00:00,"@TheRealKeean Nothing would change. Just like the royal family, Trudeau does nothing and the tax payers pay him. Just like the royal family."
19,2022-09-08 19:53:51+00:00,With the Queen passing today I suspect a few people will call in sick with the Irish flu tomorrow.
20,2022-09-08 19:42:58+00:00,"@JohnBrownlow @aliasvaughn 1943-present day as the US became knows for WACL, Western Goals Foundation, 1958 John Birch Society;  against an imaginary encroachment of communism, the UK remained worked.The Queen represented an institution, headed by a woman, a wife and a mother. The British structure endures"
21,2022-09-08 19:39:48+00:00,Mourning the loss of #QueenElizabeth Queen of #Canada on this sad day. May her memory be a blessing to all her 70 years of service touched. Sending love to the whole royal family. https://t.co/pQOQfzqDGK
22,2022-09-08 19:31:14+00:00,"To all my colleagues and friends in the UK - condolences on the passing of Queen Elizabeth II. Total dedication to her duty. ""Her reign spanned 15 prime ministers starting with Winston Churchill, born in 1874, and including Ms Truss, born 101 years later in 1975"". RIP."
23,2022-09-08 19:07:03+00:00,"Sending my condolences to the Royal family,  #UKBritain, and all who love and were touched by the life of Queen Elizabeth II. May all find peace, grace, compassion and wisdom."
24,2022-09-08 18:55:55+00:00,"#gumsandmaplesradio is with #UK and it’s #DnB #dnb #drumandbass capital there, in mourn of the death of #QueenElizabeth II. God Save the Queen. May she #RIPQueen"
25,2022-09-08 18:38:08+00:00,"We’re deeply saddened by the death HM The Queen. A dedicated supporter of Scouts, Her Majesty has been a peerless role model for our young people.  

Our thoughts are with the Royal Family. https://t.co/D1rha2nnbm"
26,2022-09-08 18:24:27+00:00,"Deeply saddened by the passing of Her Majesty Queen Elizabeth II, Queen of Canada. What a remarkable life she led. I’m so grateful for her selfless service over 70 years. Thoughts and prayers are with His Majesty King Charles III and the Royal Family. Long live the King."
27,2022-09-08 18:10:08+00:00,"I heard about Princess Diana's death in a 90's era chatroom and I heard of Queen Elizabeth's death at a poker table. Hail, the traveler. It's good to hear news and commiserate with random people in public spaces."
28,2022-09-08 18:03:26+00:00,I’ve always admired the Queen and the British monarchy. This strong woman’s death has repelling effects around the world even though her position was symbolic. RIP Queen Elizabeth II https://t.co/SDSPt5CAuL
29,2022-09-08 17:53:40+00:00,"Deeply sad listen that our Queen Elizabeth II today, great lost for@all Canadians “God Save the Queen” 🇨🇦, my condolences to the Royal Family."
30,2022-09-08 17:50:34+00:00,How tf Buckingham palace get the scoop on the queen’s death before TMZ
