,date,content31,2022-09-08 17:48:59+00:00,"We are all deeply saddened to hear of the passing of Her Majesty The Queen, Elizabeth II. Our thoughts, prayers, &amp; condolences are with The Royal Family and everyone around the world mourning the loss of Her Majesty. #QueenElizabeth #RIPQueenElizabeth #UnitedKingdom @RoyalFamily https://t.co/ZreBVLKReM"
32,2022-09-08 17:46:04+00:00,I will always remember her grace and quiet but determined voice. Today our thoughts are with her family as they mourn their matriarch #QueenElizabeth #RIP https://t.co/YHx5BqfwXD
33,2022-09-08 17:38:35+00:00,"#BREAKING: The @RoyalFamily confirms the death of The Queen today, at Balmoral, surrounded by immediate family. She was 96 years old. https://t.co/vprD8vdn0d"
34,2022-09-08 16:54:23+00:00,"Her subjects and admirers around the world, as well, wish HM The Queen well. Reports are saying she's under medical supervision. And immediate family are with her. #LongLiveTheQueen #QueenElizabeth #QueenOfCanada https://t.co/PprcJxJGdM https://t.co/IbpgkmDd1A"
35,2022-09-08 16:18:36+00:00,When the queen dies do we also get a stat holiday in Canada? The UK shuts down for like an entire week when she dies
